{
  "$schemaVersion": "2.0.0",
  "slug": "delta-air-lines",
  "brand": "Delta Air Lines",
  "category": "airline",
  "region": "north-america",
  "nativePkpass": "full",
  "iosLiveActivity": true,
  "watchSync": true,
  "lastChecked": "2026-10-01",
  "articleSlug": "delta-boarding-pass-live-activity-not-working",
  "sources": [
    {
      "url": "https://9to5mac.com/2025/11/04/ios-26-wallet-app-boarding-pass-features-ios-26/",
      "accessedAt": "2026-05-02",
      "type": "press"
    },
    {
      "url": "https://neatpass.app/learn/delta-boarding-pass-live-activity-not-working",
      "accessedAt": "2026-10-01",
      "type": "press",
      "note": "NeatPass troubleshooting guide confirms Delta Live Activity support is active as of May 2026; states 'public sources support a Delta rollout, not a confirmed rollback'."
    }
  ]
}
