{
  "$schemaVersion": "2.0.0",
  "slug": "adac-mitgliedskarte",
  "brand": "ADAC Mitgliedskarte",
  "category": "loyalty",
  "region": "dach",
  "nativePkpass": "partial",
  "iosLiveActivity": false,
  "watchSync": false,
  "lastChecked": "2026-10-01",
  "articleSlug": "adac-mitgliedskarte-apple-wallet",
  "sources": [
    {
      "url": "https://www.adac.de/mein-adac/meine-mitgliedschaft/adac-wallet/infoseite/",
      "accessedAt": "2026-10-01",
      "type": "official",
      "note": "ADAC official page confirms digital Mitgliedskarte as Apple Wallet pass for personal members; company/business memberships excluded; powered by Passcreator since end of 2023"
    }
  ]
}
