{
  "$schemaVersion": "2.0.0",
  "slug": "stocard-legacy",
  "brand": "Stocard (legacy)",
  "category": "loyalty",
  "region": "global",
  "nativePkpass": "none",
  "iosLiveActivity": false,
  "watchSync": false,
  "lastChecked": "2026-10-01",
  "articleSlug": "stocard-shutting-down",
  "notes": "Stocard is winding down. Cards must be migrated to Klarna or rebuilt as pkpass.",
  "sources": [
    {
      "url": "https://vamers.com/2026/03/20/klarna-stocard-barcodes-loyalty/",
      "type": "press",
      "accessedAt": "2026-05-02",
      "note": "Confirms Klarna shut down standalone Stocard app; users forced to migrate; Apple Watch support lost"
    },
    {
      "url": "https://forums.macrumors.com/threads/stocard-replacement.2434874/",
      "type": "community",
      "accessedAt": "2026-06-01",
      "note": "MacRumors forum confirms Stocard shutdown still in effect as of 2026; users seeking replacement apps; Klarna does not support Apple Watch"
    },
    {
      "url": "https://neatpass.app/learn/stocard-shutting-down",
      "type": "press",
      "accessedAt": "2026-07-13",
      "note": "NeatPass (July 2026): Stocard shutdown remains in effect; Klarna app does not offer Apple Wallet pass export or Apple Watch support; nativePkpass=none confirmed"
    },
    {
      "url": "https://vamers.com/2026/03/20/klarna-stocard-barcodes-loyalty/",
      "type": "press",
      "accessedAt": "2026-08-01",
      "note": "Vamers (August 2026 re-check): Stocard shutdown and Klarna migration still documented; no Apple Wallet pass export or Apple Watch support in Klarna; nativePkpass=none confirmed unchanged."
    },
    {
      "url": "https://rcards.net/blog/stocard-alternatives/",
      "accessedAt": "2026-10-01",
      "type": "press",
      "note": "RCards (2026): Stocard shutdown still in effect; Klarna app does not offer Apple Wallet pass export; nativePkpass=none confirmed unchanged."
    }
  ]
}
