{
  "$schemaVersion": "2.0.0",
  "slug": "eventim",
  "brand": "Eventim",
  "category": "event",
  "region": "europe",
  "nativePkpass": "partial",
  "iosLiveActivity": false,
  "watchSync": false,
  "lastChecked": "2026-10-01",
  "articleSlug": "eventim-ticket-apple-wallet",
  "sources": [
    {
      "url": "https://www.eventim.de/faq/de_de/category/ticketkauf/subcategory/tipps-zum-kauf/wie-fuege-ich-tickets-der-apple-wallet-hinzu/",
      "type": "official",
      "accessedAt": "2026-06-01",
      "note": "Eventim DE FAQ page confirms Apple Wallet support for select ticket types; not all orders qualify — partial remains accurate"
    },
    {
      "url": "https://www.eventim.de/faq/en_en/category/ticketkauf/subcategory/tips-for-buying/how-do-i-add-tickets-to-the-apple-wallet/",
      "type": "official",
      "accessedAt": "2026-07-13",
      "note": "Eventim EN FAQ page still live confirming Apple Wallet support for select ticket types; partial classification re-confirmed"
    },
    {
      "url": "https://tickts.co.uk/blog/adding-event-tickets-to-apple-wallet",
      "type": "community",
      "accessedAt": "2026-08-01",
      "note": "2026 iPhone guide to event tickets in Apple Wallet references Eventim as a supported platform with select ticket type availability; partial classification unchanged"
    },
    {
      "url": "https://www.eventim.de/faq/en_en/category/ticketkauf/subcategory/tips-for-buying/how-do-i-add-tickets-to-the-apple-wallet/",
      "type": "official",
      "accessedAt": "2026-10-01",
      "note": "Eventim FAQ re-verified: Apple Wallet available for Mobile Ticket / ticketdirect orders only; organizer must enable feature; partial classification confirmed"
    }
  ]
}
