{
  "$schemaVersion": "2.0.0",
  "slug": "hotel-keys-hilton-marriott-hyatt",
  "brand": "Hotel keys (Hilton, Marriott, Hyatt)",
  "category": "hotel",
  "region": "global",
  "nativePkpass": "partial",
  "iosLiveActivity": false,
  "watchSync": true,
  "lastChecked": "2026-10-01",
  "articleSlug": "hotel-key-apple-wallet",
  "notes": "Native room keys ship via the chain's app, not as a generic pkpass. Coverage varies by property. Hyatt leads with full Apple Wallet NFC key support; Hilton and Marriott use Bluetooth-based digital keys via their own apps.",
  "sources": [
    {
      "url": "https://support.apple.com/en-us/118273",
      "type": "support",
      "accessedAt": "2026-06-01",
      "note": "Apple Support: adding hotel room keys to Apple Wallet — iPhone and Apple Watch both supported"
    },
    {
      "url": "https://newsroom.hyatt.com/news-releases?item=124174",
      "type": "official",
      "accessedAt": "2026-06-01",
      "note": "Hyatt newsroom: first hotel brand to offer room keys in Apple Wallet on iPhone and Apple Watch"
    },
    {
      "url": "https://9to5mac.com/2026/06/04/room-keys-in-apple-wallet-are-coming-to-more-hotels-through-salto/",
      "type": "press",
      "accessedAt": "2026-10-01",
      "note": "9to5Mac June 2026: Salto expanding Apple Wallet NFC room keys to more hotel brands; Hilton properties also gaining Apple Wallet key support via Salto locks; partial classification maintained"
    },
    {
      "url": "https://www.travelandtourworld.com/news/article/crmjzf70k7wx/",
      "type": "press",
      "accessedAt": "2026-08-01",
      "note": "2026: Hyatt keys stored in Apple Wallet (NFC); Hilton and Marriott use Bluetooth digital keys in own apps — partial re-confirmed"
    },
    {
      "url": "https://hotelfacilityguide.com/guest-tech/hotel-digital-key-ecosystem-2026/",
      "type": "press",
      "accessedAt": "2026-08-01",
      "note": "Hotel digital key ecosystem 2026 guide: Apple Wallet hotel keys, Google Wallet hotel keys, and wearable access credentials available at select properties across major chains"
    }
  ]
}
