{
  "$schemaVersion": "2.0.0",
  "slug": "easyjet",
  "brand": "easyJet",
  "category": "airline",
  "region": "europe",
  "nativePkpass": "partial",
  "iosLiveActivity": false,
  "watchSync": false,
  "lastChecked": "2026-10-01",
  "articleSlug": "easyjet-boarding-pass-apple-wallet",
  "sources": [
    {
      "url": "https://www.easyjet.com/en/mobile-app/mobile-boarding-passes",
      "type": "official",
      "accessedAt": "2026-10-01",
      "note": "easyJet confirms mobile boarding passes can be downloaded to Apple Wallet; not supported at ~18 specific airports (Turkey, Egypt, Morocco, etc.) — hence partial"
    }
  ]
}
