{
  "$schemaVersion": "2.0.0",
  "slug": "hawaiian-airlines",
  "brand": "Hawaiian Airlines",
  "category": "airline",
  "region": "north-america",
  "nativePkpass": "full",
  "iosLiveActivity": false,
  "watchSync": true,
  "lastChecked": "2026-10-01",
  "articleSlug": "hawaiian-airlines-boarding-pass-apple-wallet",
  "sources": [
    {
      "url": "https://apps.apple.com/us/app/alaska-hawaiian/id356143077",
      "accessedAt": "2026-08-01",
      "type": "official",
      "note": "Unified Alaska Hawaiian iOS app confirmed live; add boarding pass, rewards and Lounge card to Apple Wallet after check-in."
    },
    {
      "url": "https://news.alaskaair.com/guest-experience/alaska-airlines-and-hawaiian-airlines-app/",
      "accessedAt": "2026-07-11",
      "type": "official",
      "note": "Alaska/Hawaiian newsroom: unified app rollout; the standalone Hawaiian app was retired in April 2026."
    },
    {
      "url": "https://www.travelandtourworld.com/news/article/alaska-and-hawaiian-airlines-launch-unified-app-a-landmark-move-for-seamless-travel-in-2026/",
      "accessedAt": "2026-08-01",
      "type": "press",
      "note": "Travel And Tour World 2026: unified Alaska Hawaiian app confirmed with Apple Wallet boarding pass integration"
    },
    {
      "url": "https://www.kitv.com/news/business/one-app-now-handles-alaska-and-hawaiian-airlines-bookings-what-travelers-should-know/article_fee081e0-8cb8-4601-a851-e3dc5532505c.html",
      "accessedAt": "2026-10-01",
      "type": "press",
      "note": "KITV 2026: unified Alaska Hawaiian app handles all bookings; Apple Wallet boarding pass Add to Wallet option available after check-in; nativePkpass=full confirmed"
    }
  ]
}
