{
  "$schemaVersion": "2.0.0",
  "slug": "mathaeser",
  "brand": "Mathäser",
  "category": "cinema",
  "region": "dach",
  "nativePkpass": "partial",
  "iosLiveActivity": false,
  "watchSync": false,
  "lastChecked": "2026-10-01",
  "sources": [
    {
      "url": "https://www.mathaeser.de/mm/agb",
      "accessedAt": "2026-05-02",
      "type": "official",
      "note": "AGB explicitly references Passbook as electronic ticket delivery option"
    },
    {
      "url": "https://www.mathaeser.de/mm/angebote/unsere-app/35",
      "accessedAt": "2026-05-02",
      "type": "official",
      "note": "Official app promotion page"
    },
    {
      "url": "https://www.mathaeser.de/mm/faqs",
      "accessedAt": "2026-05-02",
      "type": "official",
      "note": "FAQ mentions Wallet-Datei for CineCard download"
    },
    {
      "url": "https://apps.apple.com/de/app/math%C3%A4ser/id1177522864",
      "accessedAt": "2026-07-13",
      "type": "official",
      "note": "App Store listing confirms Wallet-Datei (pkpass) available for CineCard download; partial rating confirmed"
    },
    {
      "url": "https://apps.apple.com/de/app/math%C3%A4ser/id1177522864",
      "accessedAt": "2026-10-01",
      "type": "official",
      "note": "Oct 2026 re-check: App Store listing still active; Wallet-Datei (pkpass) for CineCard confirmed; partial status unchanged"
    }
  ]
}
