{
  "$schemaVersion": "2.0.0",
  "slug": "aarp",
  "brand": "AARP",
  "category": "loyalty",
  "region": "north-america",
  "nativePkpass": "full",
  "iosLiveActivity": false,
  "watchSync": false,
  "lastChecked": "2026-10-01",
  "articleSlug": "aarp-card-apple-wallet",
  "sources": [
    {
      "url": "https://help.aarp.org/s/article/how-do-i-add-my-membership-card-to-apple-wallet",
      "accessedAt": "2026-10-01",
      "type": "official",
      "note": "AARP help article confirms Add to Apple Wallet via AARP Now app or aarp.org/digitalcard/; widespread reports of button silently failing after renewal or device change"
    },
    {
      "url": "https://community.aarp.org/t5/Membership/Unable-to-Add-Updated-Renewed-Membership-Card-to-Apple-Wallet/td-p/2600157",
      "accessedAt": "2026-07-13",
      "type": "community",
      "note": "AARP community thread documents widespread failure of Add to Apple Wallet button after renewal; issue unresolved as of July 2026"
    }
  ]
}
