{
  "$schemaVersion": "2.0.0",
  "slug": "lidl-plus",
  "brand": "Lidl Plus",
  "category": "loyalty",
  "region": "europe",
  "nativePkpass": "none",
  "iosLiveActivity": false,
  "watchSync": false,
  "lastChecked": "2026-10-01",
  "articleSlug": "lidl-plus-apple-wallet",
  "sources": [
    {
      "url": "https://apps.apple.com/rs/app/lidl-plus/id1238611143",
      "type": "official",
      "accessedAt": "2026-07-13",
      "note": "Lidl Plus App Store listing — user reviews request Apple Wallet support; not currently offered"
    },
    {
      "url": "https://discussions.apple.com/thread/256023797",
      "type": "community",
      "accessedAt": "2026-07-13",
      "note": "Apple Community: user unable to add Lidl card to Apple Wallet — confirms no native export option"
    },
    {
      "url": "https://neatpass.app/learn/lidl-plus-apple-wallet",
      "type": "press",
      "accessedAt": "2026-10-01",
      "note": "NeatPass 2026: Lidl Plus does not officially support Apple Wallet; app-based scheme only; coupons must still be activated in-app"
    }
  ]
}
