{
  "$schemaVersion": "2.0.0",
  "slug": "ryanair",
  "brand": "Ryanair",
  "category": "airline",
  "region": "europe",
  "nativePkpass": "partial",
  "iosLiveActivity": false,
  "watchSync": false,
  "knownIssues": [
    "Wallet button often hidden behind in-app boarding pass viewer"
  ],
  "lastChecked": "2026-10-01",
  "articleSlug": "ryanair-boarding-pass-apple-wallet",
  "sources": [
    {
      "url": "https://apps.apple.com/gr/app/ryanair/id504270602",
      "accessedAt": "2026-06-01",
      "type": "official",
      "note": "App Store listing confirms 'Supports Wallet'; boarding passes can be added to Apple Wallet"
    },
    {
      "url": "https://help.ryanair.com/hc/en-gb/articles/360017683417-Mobile-Boarding-Passes",
      "accessedAt": "2026-07-13",
      "type": "official",
      "note": "Ryanair help center: digital boarding passes require Ryanair App; Wallet button may be hidden behind in-app viewer; paper boarding passes no longer accepted since Nov 2025"
    },
    {
      "url": "https://help.ryanair.com/hc/en-gb/articles/360017683417-Mobile-Boarding-Passes",
      "accessedAt": "2026-08-01",
      "type": "official",
      "note": "Aug 2026 re-check: Ryanair mobile boarding pass help still live; Apple Wallet export confirmed; partial status unchanged"
    },
    {
      "url": "https://hauptstadtkoffer.de/en/news/post/ryanair-app-2026-digital-boarding-pass-mandatory-%E2%80%93-what-you-need-to-know-now",
      "accessedAt": "2026-10-01",
      "type": "press",
      "note": "Oct 2026 re-check: digital boarding pass mandatory since Nov 2025; Apple Wallet boarding pass confirmed via myRyanair app; Wallet button appears only after check-in; partial status unchanged"
    }
  ]
}
