{
  "$schemaVersion": "2.0.0",
  "slug": "fever",
  "brand": "Fever",
  "category": "event",
  "region": "global",
  "nativePkpass": "partial",
  "iosLiveActivity": false,
  "watchSync": false,
  "lastChecked": "2026-10-01",
  "articleSlug": "fever-tickets-apple-wallet",
  "notes": "Fever acquired DICE in June 2025. Apple Wallet support is available via the Fever app for some events (sports, concerts) but not consistently across all event types.",
  "sources": [
    {
      "url": "https://business.feverup.com/industries/sports-ticketing-software/",
      "type": "official",
      "accessedAt": "2026-05-02",
      "note": "Fever business page confirms fans can save tickets to Apple or Google Wallet; availability appears event/venue dependent — partial remains accurate"
    },
    {
      "url": "https://support.feverup.com/hc/en-us/articles/6012557084436-Where-can-I-find-my-tickets",
      "type": "official",
      "accessedAt": "2026-06-01",
      "note": "Fever support page confirms Apple Wallet integration available for ticket access; event/venue dependent availability"
    },
    {
      "url": "https://apps.apple.com/us/app/fever-events-tickets/id497702817",
      "type": "official",
      "accessedAt": "2026-08-01",
      "note": "Fever App Store listing confirmed live; Apple Wallet ticket integration still available; partial classification re-confirmed"
    },
    {
      "url": "https://support.feverup.com/hc/en-us/articles/38499271754388-How-do-I-purchase-a-ticket",
      "type": "official",
      "accessedAt": "2026-08-01",
      "note": "Fever support: ticket purchase flow includes Add to Apple Wallet or Google Wallet option after purchase; event-dependent"
    },
    {
      "url": "https://apps.apple.com/lc/app/fever-events-tickets/id497702817",
      "type": "official",
      "accessedAt": "2026-10-01",
      "note": "Fever App Store listing confirmed live October 2026, last updated May 25 2026; Apple Wallet ticket integration still available; partial classification re-confirmed"
    }
  ]
}
