{
  "$schemaVersion": "2.0.0",
  "slug": "oebb",
  "brand": "OEBB",
  "category": "transit",
  "region": "europe",
  "nativePkpass": "none",
  "iosLiveActivity": false,
  "watchSync": false,
  "lastChecked": "2026-10-01",
  "articleSlug": "oebb-ticket-apple-wallet",
  "notes": "ÖBB app supports Apple Pay for payments but does not offer native pkpass/Apple Wallet ticket storage. Users can place tickets as home-screen widgets only.",
  "sources": [
    {
      "url": "https://www.oebb.at/en/tickets-kundenkarten/online-mobile-ticketing/oebb-app",
      "accessedAt": "2026-06-01",
      "type": "official",
      "note": "ÖBB official app page: no mention of Apple Wallet pkpass support; only Apple Pay for payments and home-screen widgets"
    },
    {
      "url": "https://apps.apple.com/us/app/%C3%B6bb-tickets/id1041401604",
      "accessedAt": "2026-07-13",
      "type": "official",
      "note": "App Store listing does not include Wallet support badge; only Apple Pay for payment is mentioned; no pkpass support confirmed"
    },
    {
      "url": "https://www.oebb.at/en/tickets-kundenkarten/online-mobile-ticketing/oebb-app",
      "accessedAt": "2026-08-01",
      "type": "official",
      "note": "Aug 2026 re-check: ÖBB official app page still shows no Apple Wallet pkpass support; none status confirmed"
    },
    {
      "url": "https://www.oebb.at/en/tickets-kundenkarten/online-mobile-ticketing/oebb-app",
      "accessedAt": "2026-10-01",
      "type": "official",
      "note": "Oct 2026 re-check: ÖBB app still offers no native pkpass/Apple Wallet ticket export; tickets remain in-app only; none status confirmed"
    }
  ]
}
