{
  "$schemaVersion": "2.0.0",
  "slug": "wiener-linien",
  "brand": "Wiener Linien",
  "category": "transit",
  "region": "europe",
  "nativePkpass": "none",
  "iosLiveActivity": false,
  "watchSync": false,
  "lastChecked": "2026-10-01",
  "articleSlug": "wiener-linien-ticket-apple-wallet",
  "sources": [
    {
      "url": "https://www.wienerlinien.at/tapandride",
      "accessedAt": "2026-08-01",
      "type": "official",
      "note": "Wiener Linien Tap+Ride pilot uses open-loop cards/Apple Express Mode; WienMobil keeps tickets in-app, no native Apple Wallet pass."
    },
    {
      "url": "https://presse.wien.gv.at/presse/2026/05/25/ein-tap-und-los-wiener-linien-starten-mit-tap-ride-neue-besonders-einfache-ticketloesung",
      "accessedAt": "2026-07-11",
      "type": "press",
      "note": "City of Vienna press release: the Tap+Ride pilot is open-loop payment at selected stations, not a native Wallet ticket."
    },
    {
      "url": "https://presse.wien.gv.at/presse/2026/09/30/digitale-services-moderne-technik-wiener-linien-entwickeln-angebot-weiter",
      "accessedAt": "2026-10-01",
      "type": "press",
      "note": "Sept 2026 Wiener Linien digital services press release: WienMobil app and Tap+Ride continue as key digital channels; no Apple Wallet native pass announced."
    }
  ]
}
